{
  "$schema": "https://json-schema.org/draft/2020-12/schema",
  "$id": "upskill-design-system/component.schema.json",
  "title": "Component Metadata",
  "description": "Selection and composition guidance for a component. The builder sections (states, accessibility, and the token list derived from styles) live in <Name>.spec.json (ADR-001 amendment 2026-10-11, ADR-027).",
  "type": "object",
  "required": [
    "component",
    "usage",
    "variants",
    "composition"
  ],
  "properties": {
    "component": {
      "type": "object",
      "required": ["name", "category", "type", "status", "description"],
      "properties": {
        "name": { "type": "string" },
        "category": {
          "type": "string",
          "enum": ["atom", "molecule", "organism", "layout"]
        },
        "type": {
          "type": "string",
          "enum": ["interactive", "display", "container", "input"]
        },
        "status": {
          "type": "string",
          "enum": ["beta", "ready", "deprecated"]
        },
        "description": { "type": "string" },
        "figmaNodeId": {
          "type": "string",
          "pattern": "^([0-9]+:[0-9]+|none)$",
          "description": "The Figma component set node id, or \"none\" when the component has no set (layout, text styles, single components)."
        }
      },
      "additionalProperties": false
    },

    "usage": {
      "type": "object",
      "required": ["keywords", "when", "antiPatterns"],
      "properties": {
        "keywords": {
          "description": "Terms an agent uses to match intent to this component during layout generation or selection.",
          "type": "array",
          "items": { "type": "string" }
        },
        "when": {
          "description": "Scenarios where this component is the right choice.",
          "type": "array",
          "items": { "type": "string" }
        },
        "patterns": {
          "description": "Named, proven compositions using this component. Guidance for layout generation — prefer a named pattern over ad-hoc composition when one fits.",
          "type": "array",
          "items": {
            "type": "object",
            "required": ["name", "description", "tree"],
            "properties": {
              "name": { "type": "string" },
              "description": { "type": "string" },
              "tree": {
                "type": "string",
                "description": "Component tree as a readable expression, e.g. 'Card > Stack > [Heading, Text, Button(primary)]'"
              }
            },
            "additionalProperties": false
          }
        },
        "antiPatterns": {
          "description": "Explicit misuses and implementation mistakes. Anti-patterns are load-bearing — they prevent the most common agent errors.",
          "type": "array",
          "items": {
            "type": "object",
            "required": ["scenario", "reason", "alternative"],
            "properties": {
              "scenario": { "type": "string" },
              "reason": { "type": "string" },
              "alternative": { "type": "string" }
            },
            "additionalProperties": false
          }
        }
      },
      "additionalProperties": false
    },

    "variants": {
      "description": "Named variant axes. Each key is an independent axis (e.g. variant, size, shape). A single-axis component declares one axis named `variant`; a component with no visual variation declares `variant` with a single `default` option.",
      "type": "object",
      "minProperties": 1,
      "additionalProperties": {
        "type": "object",
        "required": ["options", "default", "purpose"],
        "properties": {
          "options": {
            "type": "array",
            "items": { "type": "string" }
          },
          "default": {
            "type": ["string", "null"],
            "description": "Default option for this axis, or null when the axis is off by default (e.g. an icon-only shape applied only when set)."
          },
          "purpose": {
            "description": "Per-option selection guidance — when to choose each option on this axis over the others.",
            "type": "object",
            "additionalProperties": { "type": "string" }
          }
        },
        "additionalProperties": false
      }
    },




    "composition": {
      "description": "Component graph topology: what this component is built from, what it accepts, where it belongs, and how it behaves in a layout.",
      "type": "object",
      "properties": {
        "composedOf": {
          "description": "Library components used internally to build this component.",
          "type": "array",
          "items": { "type": "string" }
        },
        "accepts": {
          "description": "Component names valid as direct children in this component's content slot. Empty array means leaf node. [\"*\"] means any library component is valid.",
          "type": "array",
          "items": { "type": "string" }
        },
        "containedBy": {
          "description": "Component names that are valid direct parents of this component.",
          "type": "array",
          "items": { "type": "string" }
        },
        "parts": {
          "description": "Subcomponents reachable as <Name>.<Part> (ADR-023). Parts are not components: they have no folder and are declared only here. Cross-references (accepts/containedBy/builtOn) are checked by scripts/validate-metadata.js.",
          "type": "array",
          "items": {
            "type": "object",
            "required": ["name", "kind", "description", "builtOn"],
            "properties": {
              "name": {
                "type": "string",
                "pattern": "^[A-Z][A-Za-z0-9]*$",
                "description": "PascalCase part name; also the Figma layer name (naming contract, ADR-023)."
              },
              "kind": {
                "type": "string",
                "enum": ["fixed", "slot", "open"],
                "description": "fixed = content/state props only, layout owned by the parent's CSS Module; slot = exactly one child from accepts; open = any children from accepts, laid out by a primitive with fixed props."
              },
              "description": { "type": "string" },
              "builtOn": {
                "type": ["string", "null"],
                "description": "Library component this part renders (e.g. Stack for an open part), or null when it renders plain elements."
              },
              "required": {
                "type": "boolean",
                "description": "Whether every instance of each containedBy part must include this part as a direct child."
              },
              "accepts": {
                "description": "Component or sibling-part names valid as direct children. slot and open parts only.",
                "type": "array",
                "items": { "type": "string" }
              },
              "containedBy": {
                "description": "Sibling-part names valid as this part's direct parent. Omit when the part may appear anywhere (e.g. Root).",
                "type": "array",
                "items": { "type": "string" }
              }
            },
            "additionalProperties": false
          }
        },
        "layoutBehavior": {
          "description": "How this component behaves inside a layout container. Used by the layout generation moment.",
          "type": "object",
          "properties": {
            "widthBehavior": {
              "type": "string",
              "enum": ["fill", "hug", "fixed"],
              "description": "fill = stretches to parent width; hug = sizes to content; fixed = component sets its own width"
            },
            "displayType": {
              "type": "string",
              "enum": ["block", "inline", "flex-column", "flex-row", "grid"]
            },
            "canNest": {
              "type": "boolean",
              "description": "Whether this component can be meaningfully nested inside another instance of itself"
            }
          },
          "additionalProperties": false
        }
      },
      "additionalProperties": false
    }
  },
  "additionalProperties": false
}
