{
  "component": {
    "name": "VideoFrame",
    "category": "atom",
    "type": "display",
    "status": "beta",
    "description": "Rounded thumbnail container with a fixed 16:9 aspect ratio and a centred semi-transparent play-button overlay. Purely presentational — no playback logic. Props: src (thumbnail URL) and alt.",
    "figmaNodeId": "none"
  },
  "usage": {
    "keywords": [
      "video",
      "video frame",
      "thumbnail",
      "play button",
      "preview",
      "media"
    ],
    "when": [
      "Displaying a video course preview with a recognisable play affordance",
      "The content is a non-interactive thumbnail that represents a video — clicking is handled by the parent"
    ],
    "patterns": [
      {
        "name": "video-preview-card",
        "description": "A VideoFrame above a title and description, used to preview a course video.",
        "tree": "Stack(gap=md) > [VideoFrame, Heading(size=subheader), Text(size=body-default)]"
      }
    ],
    "antiPatterns": [
      {
        "scenario": "Using VideoFrame for non-video image content",
        "reason": "The play overlay signals video content; using it for static images misleads users.",
        "alternative": "Use the Image component directly for non-video thumbnails."
      },
      {
        "scenario": "Putting playback logic inside VideoFrame",
        "reason": "VideoFrame is purely presentational. Adding state and media controls couples it to a specific player implementation.",
        "alternative": "Wrap VideoFrame in a parent that handles click events and video playback separately."
      }
    ]
  },
  "variants": {
    "variant": {
      "options": [
        "default"
      ],
      "default": "default",
      "purpose": {
        "default": "16:9 thumbnail with centred play overlay."
      }
    }
  },
  "composition": {
    "composedOf": [],
    "accepts": [],
    "containedBy": [
      "Box",
      "Stack",
      "Card"
    ],
    "layoutBehavior": {
      "widthBehavior": "fill",
      "displayType": "block",
      "canNest": false
    }
  }
}
