{
  "component": {
    "name": "Card",
    "category": "molecule",
    "type": "container",
    "status": "beta",
    "description": "A generic surface container that groups related content with consistent padding, border-radius, and optional elevation. Use to visually separate page sections or form groups. Card is slot-based (children-only) and carries no content structure of its own — for course display use CardVertical or CardHorizontal instead.",
    "figmaNodeId": "none"
  },
  "usage": {
    "keywords": [
      "card",
      "surface",
      "container",
      "panel",
      "section",
      "group",
      "box",
      "elevated"
    ],
    "when": [
      "Grouping a set of related form fields or content items into a distinct visual section",
      "A page section needs a distinct background to separate it from the page canvas",
      "Displaying a content item (course, article, product) in a list or grid",
      "A feature or selected state needs visual elevation above sibling content"
    ],
    "patterns": [
      {
        "name": "form-section",
        "description": "A Card wrapping a Stack of form inputs, used to group related fields in a settings or onboarding form.",
        "tree": "Card > Stack(gap=lg) > [Heading, TextField, TextField, Select]"
      },
      {
        "name": "preferences-section",
        "description": "A Card wrapping a group of Checkboxes with a section heading.",
        "tree": "Card > Stack(gap=lg) > [Heading, Stack(gap=md) > [Checkbox, Checkbox, Checkbox]]"
      },
      {
        "name": "content-card",
        "description": "A Card presenting a single content item (course, article) with title, metadata, body text, and a CTA Button.",
        "tree": "Card > Stack(gap=md) > [Stack(gap=xs) > [Heading, Text(size=body-small)], Text, Button(variant=neutral, size=sm)]"
      }
    ],
    "antiPatterns": [
      {
        "scenario": "Nesting Cards inside Cards",
        "reason": "Creates visual depth that is hard to scan; nested surfaces lose hierarchy meaning.",
        "alternative": "Separate the inner content into a Stack or Box, or reconsider the layout hierarchy."
      },
      {
        "scenario": "Using Card as a full-page background",
        "reason": "Card is a grouping surface, not a page background. A full-page card makes every section a nested container.",
        "alternative": "Use Box background='canvas' (or the container-canvas token) on the root layout element."
      },
      {
        "scenario": "Using Card to display a course (with image, title, metadata)",
        "reason": "Card is children-based and carries no content structure. Course display requires fixed structure (image zone, title, metadata row, optional progress).",
        "alternative": "Use CardVertical for catalog grids or CardHorizontal for course lists and footers."
      },
      {
        "scenario": "Using padding='none' and adding raw padding via style",
        "reason": "Bypasses the token-driven padding system; visual inconsistency results.",
        "alternative": "Use the padding prop ('sm', 'md', 'lg') for all padding needs."
      },
      {
        "scenario": "Using Card as a sibling of CardVertical or CardHorizontal in the same layout group",
        "reason": "Card is a generic surface container; CardVertical and CardHorizontal are semantic course cards with fixed layouts. Mixing them in the same list or grid breaks visual rhythm and semantic consistency.",
        "alternative": "Choose one card type per section. Use Card for generic content grouping; use CardVertical or CardHorizontal for course content — never both in the same visual row or list."
      }
    ]
  },
  "variants": {
    "variant": {
      "options": [
        "default",
        "elevated",
        "transparent"
      ],
      "default": "default",
      "purpose": {
        "default": "Flat surface on the page background. Primary container for form sections and content groups.",
        "elevated": "Raised surface above the page background. Use for featured content, selected card states, or content that must visually float above siblings.",
        "transparent": "No fill — keeps Card's border and padding as a grouping outline without separating its background from the page canvas."
      }
    }
  },
  "composition": {
    "composedOf": [],
    "accepts": [
      "*"
    ],
    "containedBy": [
      "Box",
      "Stack",
      "Inline"
    ],
    "layoutBehavior": {
      "widthBehavior": "fill",
      "displayType": "block",
      "canNest": false
    }
  }
}
