{
  "component": {
    "name": "Select",
    "category": "molecule",
    "type": "input",
    "status": "beta",
    "description": "A labelled dropdown selector for choosing one option from a predefined list. Includes a visible label, a custom chevron indicator, optional placeholder, and an optional error message. Wraps a native <select> element for built-in accessibility and mobile keyboard support.",
    "figmaNodeId": "2879:8375"
  },
  "usage": {
    "keywords": [
      "select",
      "dropdown",
      "choose",
      "option",
      "list",
      "picker",
      "form"
    ],
    "when": [
      "The user must pick exactly one value from a known, finite set of options",
      "The option list is too long for radio buttons (more than 4–5 options)",
      "Mobile usability is a priority — native selects open the platform picker"
    ],
    "patterns": [
      {
        "name": "form-field-stack",
        "description": "A vertical series of labelled inputs inside a Card, with Select used for option sets and TextField for freeform entries.",
        "tree": "Card > Stack(gap=lg) > [Heading, TextField, TextField, Select]"
      }
    ],
    "antiPatterns": [
      {
        "scenario": "Using Select for freeform text entry",
        "reason": "Select only accepts predefined options; typed input is silently ignored.",
        "alternative": "Use TextField for any freeform input."
      },
      {
        "scenario": "Using Select for boolean or two-option choices",
        "reason": "Two-option selects are harder to scan than a pair of radio buttons or a Checkbox.",
        "alternative": "Use Checkbox for a single on/off toggle; use radio inputs for two mutually exclusive choices."
      },
      {
        "scenario": "Omitting the label prop",
        "reason": "The label is required for accessibility — the native <select> needs a programmatic label.",
        "alternative": "Always pass a visible label string."
      }
    ]
  },
  "variants": {
    "variant": {
      "options": [
        "default"
      ],
      "default": "default",
      "purpose": {
        "default": "Standard dropdown with label. Error state is controlled via the error prop."
      }
    }
  },
  "composition": {
    "composedOf": [
      "DropdownMenu",
      "Icon",
      "Text"
    ],
    "accepts": [],
    "containedBy": [
      "Box",
      "Stack",
      "Card"
    ],
    "layoutBehavior": {
      "widthBehavior": "fill",
      "displayType": "flex-column",
      "canNest": false
    }
  }
}
