{
  "component": {
    "name": "Stack",
    "category": "layout",
    "type": "container",
    "status": "beta",
    "description": "Vertical flex container. Stacks children top-to-bottom with consistent spacing from the space.stack token scale. The primary building block for content hierarchy within a page section.",
    "figmaNodeId": "none"
  },
  "usage": {
    "keywords": [
      "stack",
      "vertical",
      "column",
      "flex",
      "spacing",
      "layout",
      "list"
    ],
    "when": [
      "Arranging content vertically with consistent spacing between items",
      "Building a form, card body, or sidebar section where elements flow top-to-bottom",
      "Composing a heading + body text + action group in a single vertical flow"
    ],
    "patterns": [
      {
        "name": "form-field-group",
        "description": "Vertical list of form fields with consistent spacing.",
        "tree": "Stack(gap=md) > [TextField, TextField, Select, Checkbox]"
      },
      {
        "name": "content-block",
        "description": "Heading followed by body text and a CTA action.",
        "tree": "Stack(gap=sm) > [Heading, Text, Button]"
      },
      {
        "name": "card-body",
        "description": "Card inner content arranged as a vertical stack.",
        "tree": "Card > Box(padding=lg) > Stack(gap=sm) > [Heading, Text]"
      }
    ],
    "antiPatterns": [
      {
        "scenario": "Using Stack for horizontal layout",
        "reason": "Stack is always column direction. Horizontal spacing belongs to Inline.",
        "alternative": "Use Inline for side-by-side arrangement of items"
      },
      {
        "scenario": "Nesting Stack inside Stack with the same gap just to group items",
        "reason": "Redundant nesting with identical gaps is visual noise with no structural benefit",
        "alternative": "Use a single Stack and rely on Box with padding to create visual grouping if needed"
      },
      {
        "scenario": "Hand-writing style={{ flex: '1 0 0' }}, style={{ minWidth }}, style={{ maxWidth }}, style={{ minHeight }}, or style={{ maxHeight }} on a Stack for column fill or size constraints",
        "reason": "Stack has first-class grow/minWidth/maxWidth/minHeight/maxHeight props that emit the same CSS through the component's own style resolution — inline style duplicates this and drifts from it over time.",
        "alternative": "Use the grow prop (flex: n 0 0) for column fill, and minWidth/maxWidth/minHeight/maxHeight props for size constraints, instead of an inline style object."
      }
    ]
  },
  "variants": {
    "variant": {
      "options": [
        "default"
      ],
      "default": "default",
      "purpose": {
        "default": "Column flex container with configurable gap, alignment, and justification."
      }
    }
  },
  "composition": {
    "composedOf": [],
    "accepts": [
      "Box",
      "Stack",
      "Inline",
      "Text",
      "Heading",
      "Icon",
      "Button",
      "TextField",
      "Select",
      "Checkbox",
      "Card"
    ],
    "containedBy": [
      "Box",
      "Stack",
      "Inline",
      "Card"
    ],
    "layoutBehavior": {
      "widthBehavior": "fill",
      "displayType": "flex-column",
      "canNest": true
    }
  }
}
