{
  "component": {
    "name": "TextField",
    "category": "molecule",
    "type": "input",
    "status": "beta",
    "description": "A labelled text input for collecting single-line user data. Includes a visible label, an optional error message with ARIA association, and interaction states. Use for any freeform text entry: names, emails, passwords, search terms.",
    "figmaNodeId": "2879:8549"
  },
  "usage": {
    "keywords": [
      "input",
      "text",
      "field",
      "form",
      "label",
      "email",
      "password",
      "search",
      "entry"
    ],
    "when": [
      "Collecting freeform single-line text from the user (name, email, password, search query)",
      "A form field needs a visible label and optional error feedback",
      "The value is typed, not selected — use Select for predefined option sets"
    ],
    "patterns": [
      {
        "name": "inline-name-row",
        "description": "Two TextFields side by side for first/last name — each wrapped in a Box with flex:1 so they share the available width equally.",
        "tree": "Inline(gap=md, align=start) > [Box(style={flex:1}) > TextField(label='First name'), Box(style={flex:1}) > TextField(label='Last name')]"
      },
      {
        "name": "form-field-stack",
        "description": "A vertical series of labelled fields inside a Card, grouped by topic.",
        "tree": "Card > Stack(gap=lg) > [Heading, TextField, TextField, Select]"
      }
    ],
    "antiPatterns": [
      {
        "scenario": "Using TextField for multi-line text",
        "reason": "Renders a single-line <input>; tall freeform content (bio, comments) needs a <textarea>.",
        "alternative": "Use a native <textarea> styled with design tokens until a TextArea component is added."
      },
      {
        "scenario": "Using TextField for choosing from a fixed list",
        "reason": "Freeform text provides no validation or keyboard-navigable option list.",
        "alternative": "Use Select when the options are known and finite."
      },
      {
        "scenario": "Omitting the label prop",
        "reason": "The label is required for accessibility — screen readers need it to describe the field.",
        "alternative": "Always pass a visible label. If the design shows no visible label, add an aria-label to the input via ...rest and consult the design system owner."
      }
    ]
  },
  "variants": {
    "icon": {
      "options": [
        "none",
        "any IconName"
      ],
      "default": "none",
      "purpose": {
        "none": "No icon. Standard text input.",
        "any IconName": "Renders a decorative icon on the leading (left) side. Use 'search' for search inputs. Icon is aria-hidden."
      }
    },
    "size": {
      "options": [
        "md",
        "lg"
      ],
      "default": "md",
      "purpose": {
        "md": "40px tall. Standard form fields and inline inputs.",
        "lg": "48px tall. Hero search bars, prominent single-field forms."
      }
    },
    "shape": {
      "options": [
        "square",
        "round"
      ],
      "default": "square",
      "purpose": {
        "square": "Rounded-corner rectangle (border-radius-sm). Default for form fields.",
        "round": "Pill shape (border-radius-full). Use for search inputs or brand-forward contexts."
      }
    }
  },
  "composition": {
    "composedOf": [
      "Icon",
      "Text"
    ],
    "accepts": [],
    "containedBy": [
      "Box",
      "Stack",
      "Card"
    ],
    "layoutBehavior": {
      "widthBehavior": "fill",
      "displayType": "flex-column",
      "canNest": false
    }
  }
}
