{
  "component": {
    "name": "Heading",
    "category": "atom",
    "type": "display",
    "status": "beta",
    "description": "Renders heading-level text using title and display size tokens. The as prop controls semantic HTML level (h1\u2013h6); the size prop controls visual appearance independently. Does not add margin.",
    "figmaNodeId": "none"
  },
  "usage": {
    "keywords": [
      "heading",
      "title",
      "headline",
      "display",
      "section",
      "h1",
      "h2",
      "h3"
    ],
    "when": [
      "Labelling a page, section, or content region with a heading",
      "Rendering a display-scale hero headline",
      "Introducing a content block that a Text component will follow"
    ],
    "patterns": [
      {
        "name": "titled-section",
        "description": "A Heading followed by Text inside a Stack to form a titled content block.",
        "tree": "Stack(gap=sm) > [Heading(size=headline, as=h2), Text(size=body-default)]"
      },
      {
        "name": "hero-block",
        "description": "A display-scale heading centered in a padded Box with supporting Text and an Inline of actions.",
        "tree": "Box(paddingY=xxl) > Stack(gap=md, align=center) > [Heading(size=display, as=h1), Text(size=subheader, color=subtle), Inline(gap=sm) > [Button, Button]]"
      }
    ],
    "antiPatterns": [
      {
        "scenario": "Choosing size to match visual hierarchy instead of semantic level",
        "reason": "size and as are independent \u2014 use as for document structure and size for visual scale",
        "alternative": "Set as to the correct heading level (h1 for the page title, h2 for sections, etc.) then choose size independently"
      },
      {
        "scenario": "Using Heading for body copy or labels",
        "reason": "Heading sizes are designed for titles; body copy and labels have their own tokens",
        "alternative": "Use Text with size body-default, body-small, metadata, or label"
      }
    ]
  },
  "variants": {
    "size": {
      "options": [
        "title-small",
        "subheader",
        "headline",
        "headline-serif",
        "display"
      ],
      "default": "headline",
      "purpose": {
        "title-small": "Card titles, widget headers. 1.125rem semibold.",
        "subheader": "Section sub-labels or feature callouts. 1.375rem semibold.",
        "headline": "Primary section headings. 1.625rem semibold.",
        "headline-serif": "Editorial or feature headings in the serif typeface. 1.75rem medium.",
        "display": "Hero headlines. 2rem serif, medium weight, tight leading."
      }
    },
    "color": {
      "options": [
        "default",
        "subtle",
        "brand",
        "inverted"
      ],
      "default": "default",
      "purpose": {
        "default": "Primary heading colour on the page surface.",
        "subtle": "De-emphasised heading, e.g. a secondary section label.",
        "brand": "Brand-coloured heading for accent or featured sections.",
        "inverted": "Primary heading colour on an inverted (dark) surface, e.g. a CTA banner."
      }
    }
  },
  "composition": {
    "composedOf": [],
    "accepts": [],
    "containedBy": [
      "Box",
      "Stack",
      "Inline",
      "Card"
    ],
    "layoutBehavior": {
      "widthBehavior": "fill",
      "displayType": "block",
      "canNest": false
    }
  }
}
