{
  "component": {
    "name": "Checkbox",
    "category": "molecule",
    "type": "input",
    "status": "beta",
    "description": "A boolean toggle with a visible label. Wraps a native <input type='checkbox'> styled with design tokens. Use for independent on/off options; for exclusive choices use radio inputs. Supports checked, unchecked, disabled, and disabled-checked states.",
    "figmaNodeId": "92:8772"
  },
  "usage": {
    "keywords": [
      "checkbox",
      "toggle",
      "boolean",
      "agree",
      "opt-in",
      "notification",
      "preference",
      "multi-select"
    ],
    "when": [
      "The user can independently toggle a single option on or off",
      "Multiple independent options can be enabled simultaneously (notification preferences, feature flags)",
      "The user must confirm an agreement or consent"
    ],
    "patterns": [
      {
        "name": "notification-preferences",
        "description": "A group of independent Checkboxes in a Stack, each representing a toggleable preference.",
        "tree": "Card > Stack(gap=lg) > [Heading, Stack(gap=md) > [Checkbox, Checkbox, Checkbox]]"
      }
    ],
    "antiPatterns": [
      {
        "scenario": "Using Checkbox for mutually exclusive choices",
        "reason": "Multiple checkboxes look like independent options; users expect to be able to select more than one.",
        "alternative": "Use native radio inputs for single-select-from-set (e.g. gender, payment method)."
      },
      {
        "scenario": "Omitting the label prop",
        "reason": "The label is required for accessibility \u2014 the checkbox is not self-describing without visible text.",
        "alternative": "Always pass a label. If the design places the label elsewhere, pass it as aria-label via ...rest."
      },
      {
        "scenario": "Using Checkbox as a substitute for Switch/Toggle",
        "reason": "Checkboxes imply a saved state that requires a submit action; toggles imply immediate effect.",
        "alternative": "Use native <input type='checkbox'> with an immediate onChange handler and role='switch' until a Switch component is added."
      }
    ]
  },
  "variants": {
    "variant": {
      "options": [
        "default"
      ],
      "default": "default",
      "purpose": {
        "default": "Single boolean toggle. Checked/disabled states are controlled via standard HTML props."
      }
    }
  },
  "composition": {
    "composedOf": [
      "Text"
    ],
    "accepts": [],
    "containedBy": [
      "Box",
      "Stack",
      "Card"
    ],
    "layoutBehavior": {
      "widthBehavior": "hug",
      "displayType": "inline",
      "canNest": false
    }
  }
}
