{
  "component": {
    "name": "ButtonArrow",
    "category": "atom",
    "type": "interactive",
    "status": "beta",
    "description": "32px circular prev/next navigation button. Uses an Icon chevron internally. direction prop selects left or right. Disabled state: no background, muted icon, pointer-events blocked. Used in carousel paginators and chapter/slider navigators.",
    "figmaNodeId": "61:1228"
  },
  "usage": {
    "keywords": [
      "arrow",
      "prev",
      "next",
      "previous",
      "navigation",
      "carousel",
      "paginator",
      "slider",
      "chapter"
    ],
    "when": [
      "Navigating backward or forward through a carousel of cards",
      "Stepping through chapters or slides in a sequence",
      "Disabling the left arrow when at the start of a sequence, and the right arrow at the end"
    ],
    "patterns": [
      {
        "name": "carousel-paginator",
        "description": "A pair of ButtonArrow components flanking or below a carousel row, with the left disabled at the start and right disabled at the end.",
        "tree": "Inline(gap=sm, align=center) > [ButtonArrow(direction=left, disabled), ButtonArrow(direction=right)]"
      }
    ],
    "antiPatterns": [
      {
        "scenario": "Using ButtonArrow as a general-purpose icon button",
        "reason": "ButtonArrow is sized and styled for directional sequence navigation only. Its small 32px size and circular shape signal a specific role.",
        "alternative": "Use Button with shape=round for general icon-only actions."
      },
      {
        "scenario": "Omitting aria-label",
        "reason": "The component sets aria-label automatically ('Previous' / 'Next') from the direction prop. Do not override with an empty string.",
        "alternative": "Pass a more specific aria-label via rest props if the context requires it (e.g. 'Previous course')."
      }
    ]
  },
  "variants": {
    "direction": {
      "options": [
        "left",
        "right"
      ],
      "default": null,
      "purpose": {
        "left": "Chevron-left icon. Navigates to the previous item. Set disabled when at the start of the sequence.",
        "right": "Chevron-right icon. Navigates to the next item. Set disabled when at the end of the sequence."
      }
    }
  },
  "composition": {
    "composedOf": [
      "Icon"
    ],
    "accepts": [],
    "containedBy": [
      "Box",
      "Inline",
      "Stack"
    ],
    "layoutBehavior": {
      "widthBehavior": "fixed",
      "displayType": "inline",
      "canNest": false
    }
  }
}
