{
  "component": {
    "name": "Accordion",
    "category": "molecule",
    "type": "interactive",
    "status": "beta",
    "description": "A vertically stacked set of disclosure panels. Each item has a trigger (title + optional subtitle) and a collapsible content panel. Multiple items can be open simultaneously. Follows the WAI-ARIA Accordion pattern.",
    "figmaNodeId": "29:1153"
  },
  "usage": {
    "keywords": [
      "accordion",
      "collapse",
      "expand",
      "disclosure",
      "faq",
      "course",
      "module",
      "section",
      "toggle"
    ],
    "when": [
      "Presenting a list of content sections where users may only need to read a subset (e.g. course curriculum, FAQ, settings groups)",
      "Reducing vertical space by hiding detail until requested",
      "The content within each panel is self-contained and does not need to be visible simultaneously"
    ],
    "patterns": [
      {
        "name": "course-curriculum",
        "description": "A list of course modules, each expandable to reveal a description.",
        "tree": "Accordion > [AccordionItem(title, subtitle), AccordionItem(title, subtitle), ...]"
      },
      {
        "name": "faq-list",
        "description": "A set of frequently asked questions where each answer is hidden by default.",
        "tree": "Accordion > [AccordionItem(title='Question?') > Text(answer), ...]"
      }
    ],
    "antiPatterns": [
      {
        "scenario": "Using Accordion for primary navigation or tabbed content",
        "reason": "Accordion is a disclosure pattern, not navigation. Tabs or a nav component are the correct choice when content is mutually exclusive or linked to URLs.",
        "alternative": "Use a Tabs component or page-level navigation"
      },
      {
        "scenario": "Nesting Accordion inside another Accordion",
        "reason": "Deep nesting creates a confusing mental model and breaks the heading hierarchy.",
        "alternative": "Flatten the information architecture or use a sub-section heading and Text"
      },
      {
        "scenario": "Placing an Accordion where all items are always open",
        "reason": "If the content is always visible, the disclosure mechanism adds interaction cost without benefit.",
        "alternative": "Use Stack with Heading and Text for always-visible sections"
      },
      {
        "scenario": "Rendering the subtitle prop as a raw string, span, or plain HTML element",
        "reason": "Raw elements bypass the design system's typography scale and color tokens.",
        "alternative": "Use <Text as='span' size='metadata' color='subtle'> for the subtitle prop."
      },
      {
        "scenario": "Setting a color prop or style directly on the chevron Icon",
        "reason": "Icon uses currentColor — setting color on the Icon itself bypasses the token system.",
        "alternative": "Apply color.icon.default on the trigger button element; the Icon inherits it via currentColor."
      },
      {
        "scenario": "Conditionally rendering the panel element (e.g. {isOpen && <div>}) instead of always mounting it",
        "reason": "aria-controls on the trigger must point to an element that is always in the DOM. Unmounting the panel when closed means the target id does not exist in the collapsed state, breaking the ARIA association for screen readers such as NVDA + Firefox.",
        "alternative": "Always render the panel div. The native hidden attribute cannot be used directly because it forces display:none, which would break the height-transition animation — instead pair aria-hidden={!isOpen} with the panel element's inert DOM property (set imperatively via a ref, since @types/react 18 doesn't expose inert as a JSX prop) so focusable descendants inside a collapsed panel cannot be tabbed into or clicked while it is visually collapsing."
      },
      {
        "scenario": "Passing both the open prop (controlled) and defaultOpen prop simultaneously to AccordionItem",
        "reason": "The component cannot resolve two competing sources of truth. The controlled open prop silently wins over defaultOpen; a DEV-only console.warn is emitted, but the initial state discrepancy still occurs at runtime.",
        "alternative": "Use open + onOpenChange for fully controlled mode, or defaultOpen alone for uncontrolled mode. Never supply both."
      },
      {
        "scenario": "Placing elements other than AccordionItem as direct children of the Accordion container",
        "reason": "The Accordion container's CSS and ARIA structure assumes all direct children are AccordionItem elements. Arbitrary children break the border-divider pattern and the heading hierarchy.",
        "alternative": "All direct children of Accordion must be AccordionItem. Place other content above or below the Accordion wrapper."
      }
    ]
  },
  "variants": {
    "variant": {
      "options": [
        "default"
      ],
      "default": "default",
      "purpose": {
        "default": "Single variant. Visual style is always the same: transparent trigger, elevated background when expanded."
      }
    }
  },
  "composition": {
    "composedOf": [
      "Icon",
      "Text"
    ],
    "accepts": [
      "AccordionItem"
    ],
    "containedBy": [
      "Box",
      "Stack",
      "Card"
    ],
    "layoutBehavior": {
      "widthBehavior": "fill",
      "displayType": "block",
      "canNest": false
    }
  }
}
